{
  "$schema": "https://raw.githubusercontent.com/pragma-sh/pragma/main/packages/plugin-registry/pragma-plugin.schema.json",
  "name": "Junie CLI",
  "description": "Launch JetBrains Junie CLI in Pragma with live status, approvals, questions, usage limits, and session naming.",
  "categories": ["agent-plugin"],
  "images": [
    {
      "url": "https://raw.githubusercontent.com/pragma-sh/pragma/main/packages/junie-plugin/assets/junie.svg",
      "alt": "Junie logo"
    }
  ],
  "install": { "command": "node", "args": ["dist/install.mjs"] },
  "agentBinary": "junie"
}
